id,categoria,nombre,precio,descripcion_corta,descripcion_larga,imagen_miniatura,imagen_grande,disponible,calorias,proteinas_g,carbohidratos_g,grasas_g,alergeno_mariscos,alergeno_gluten,alergeno_lacteos,destacado
salon-vaca-demi-glace,proteinas,Salón de vaca demi-glace,3.25,Corte de vaca cocido a baja temperatura con salsa demi-glace.,"Corte de vaca cocido a baja temperatura en cocción lenta, logrando una textura muy suave y jugosa. Está delicadamente especiado y acompañado de una salsa demi-glace de sabor intenso y profundo, que realza todo su carácter.",salon-vaca-demi-glace-thumb.jpg,salon-vaca-demi-glace.jpg,true,320,35,8,16,false,false,false,true
filete-pollo-naranja,proteinas,Filete de pollo naranja,3.25,"Filete de pollo con salsa de naranja fresca, dulce y cítrica.","Filete de pollo sellado por fuera y jugoso por dentro, cubierto con una salsa de naranja fresca que aporta un sabor dulce, cítrico y ligeramente ácido. Un plato ligero y lleno de frescura.",filete-pollo-naranja-thumb.jpg,filete-pollo-naranja.jpg,true,280,32,12,10,false,false,false,true
pesca-blanca-mariscos,proteinas,Pesca blanca en salsa de mariscos,3.25,Pesca blanca con cremosa salsa de mariscos y sabor marino.,"Filete de pesca blanca suave y jugosa, acompañado de una cremosa salsa de mariscos elaborada con sabores del mar. Es un plato delicado, con un sabor marino equilibrado y una textura suave que lo hace muy agradable al paladar.",pesca-blanca-mariscos-thumb.jpg,pesca-blanca-mariscos.jpg,true,260,28,6,14,true,false,true,true
boeuf-stroganoff,proteinas,Boeuf stroganoff,3.25,Carne de res con champiñones en cremosa salsa con paprika.,"Trozos de carne de res tierna salteados con cebolla y champiñones, preparados con paprika, pimienta y un toque de vino. Todo se integra en una cremosa salsa de crema de leche, logrando un plato suave, aromático y lleno de sabor.",boeuf-stroganoff-thumb.jpg,boeuf-stroganoff.jpg,true,340,30,10,20,false,false,true,false
cubos-pollo-teriyaki,proteinas,Cubos de pollo teriyaki,3.25,"Pollo salteado en salsa teriyaki con soja, miel y jengibre.","Trozos de pollo tiernos y jugosos, salteados cuidadosamente hasta lograr un dorado perfecto y bañados en una salsa teriyaki elaborada con soja, miel y jengibre. Su sabor combina notas dulces y saladas en un equilibrio muy agradable.",cubos-pollo-teriyaki-thumb.jpg,cubos-pollo-teriyaki.jpg,true,290,29,15,12,false,true,false,false
pesca-blanca-chimichurri,proteinas,Pesca blanca con chimichurri,3.25,Pesca blanca grillada con chimichurri de hierbas frescas.,"Filete de pesca blanca grillado hasta quedar suave y jugoso, acompañado de una salsa chimichurri a base de hierbas frescas, aceite y especias. Su sabor es fresco, ligeramente intenso y muy aromático, ideal para resaltar su sabor natural.",pesca-blanca-chimichurri-thumb.jpg,pesca-blanca-chimichurri.jpg,true,230,27,4,12,false,false,false,false
solomillo-cerdo-ciruela,proteinas,Solomillo de cerdo en salsa de ciruela,3.25,"Solomillo marinado con curry, en salsa de ciruela agridulce.","Solomillo de cerdo horneado, marinado con curry y pimienta, que aporta un sabor especiado y aromático. Se acompaña de una salsa de ciruela suave, con notas dulces y ligeramente ácidas que equilibran los sabores.",solomillo-cerdo-ciruela-thumb.jpg,solomillo-cerdo-ciruela.jpg,true,310,33,14,13,false,false,false,false
medallon-pavo-relleno,proteinas,Medallón de pavo relleno,3.25,"Pavo relleno de albahaca, queso y panceta, grillado y horneado.","Medallón de pavo relleno de albahaca, queso y panceta, primero grillado para sellar su sabor y luego horneado hasta lograr una textura jugosa y tierna. Un plato aromático, equilibrado y lleno de carácter.",medallon-pavo-relleno-thumb.jpg,medallon-pavo-relleno.jpg,true,250,34,8,9,false,false,false,false
camarones-pomodoro,proteinas,Camarones pomodoro,3.25,"Camarones en salsa pomodoro de tomate, ajo y albahaca.","Camarones salteados con especias y bañados en una salsa pomodoro de tomates frescos, ajo y albahaca. Un plato aromático, jugoso y lleno de sabor mediterráneo.",camarones-pomodoro-thumb.jpg,camarones-pomodoro.jpg,true,220,25,10,8,true,false,false,true
arroz-chaufa,carbohidratos,Arroz chaufa,1.25,"Arroz frito con vegetales, cebollín y salsa de soja.","Arroz frito salteado con vegetales frescos y cebollín, en salsa de soja. Un plato de sabor intenso, equilibrado y ligeramente ahumado.",arroz-chaufa-thumb.jpg,arroz-chaufa.jpg,true,280,6,48,8,false,true,false,false
pure-papa,carbohidratos,Puré de papa,1.25,Puré cremoso con mantequilla y crema de leche.,"Puré cremoso de papas preparado con mantequilla y crema de leche, de textura suave y sabor clásico y reconfortante, ideal como acompañamiento.",pure-papa-thumb.jpg,pure-papa.jpg,true,200,4,30,8,false,false,true,false
majado-verde,carbohidratos,Majado verde,1.25,Plátano verde majado con mantequilla y queso.,"Plátano verde majado con mantequilla y queso, de textura suave y sabor tradicional casero. Un acompañamiento reconfortante y lleno de sabor.",majado-verde-thumb.jpg,majado-verde.jpg,true,260,8,35,10,false,false,true,false
arroz-curry-vegetales,carbohidratos,Arroz curry con vegetales,1.25,"Arroz aromático con curry, alverja, zanahoria y choclo.","Arroz aromático preparado con especias de curry, salteado con alverja, zanahoria y choclo dulce. De sabor cálido, ligeramente picante y con un toque exótico muy característico.",arroz-curry-vegetales-thumb.jpg,arroz-curry-vegetales.jpg,true,250,5,45,6,false,false,false,false
pasta-pesto,carbohidratos,Pasta al pesto,1.25,"Pasta al pesto con albahaca, ajo y frutos secos.","Pasta al dente mezclada con salsa pesto de albahaca, ajo, aceite de oliva y frutos secos. De sabor fresco, aromático y ligeramente intenso.",pasta-pesto-thumb.jpg,pasta-pesto.jpg,true,300,10,42,12,false,true,true,false
escabeche,vegetales,Escabeche,1.00,"Pepinillos, cebolla y zanahoria marinados en vinagre y vino.","Pepinillos, cebolla y zanahoria marinados en vinagre y vino blanco, con aceite y especias. De sabor ácido, intenso y ligeramente aromático.",escabeche-thumb.jpg,escabeche.jpg,true,80,2,12,3,false,false,false,false
peperonata,vegetales,Peperonata,1.00,"Pimientos, zucchini, zanahoria y tomates confitados.","Pimientos salteados lentamente con cebolla, zucchini, zanahoria en corte jardinera y tomates confitados, con especias suaves. De sabor dulce, suave y ligeramente caramelizado.",peperonata-thumb.jpg,peperonata.jpg,true,90,2,14,4,false,false,false,false
vegetales-salteados,vegetales,Vegetales salteados,1.00,Mix de vegetales al wok en salsa de soja y ostras.,"Mix de vegetales frescos salteados al wok en salsa de soja y ostras, de textura crocante y sabor intenso y equilibrado.",vegetales-salteados-thumb.jpg,vegetales-salteados.jpg,true,70,3,10,3,false,false,false,false
ensalada-frejol,vegetales,Ensalada de frejol,1.00,Frejoles frescos con vegetales y aderezo ligero.,"Frejoles frescos combinados con vegetales y aderezo ligero, de sabor suave, nutritivo y equilibrado.",ensalada-frejol-thumb.jpg,ensalada-frejol.jpg,true,120,7,18,3,false,false,false,false
vegetales-braseados,vegetales,Vegetales braseados,1.00,"Vainitas, zucchini, zanahoria y morrón braseados con hierbas.","Vainitas, zucchini, zanahoria y morrón rojo braseados lentamente con sal en grano y aceite de oliva, aromatizados con hojas frescas. De textura suave y sabor natural concentrado.",vegetales-braseados-thumb.jpg,vegetales-braseados.jpg,true,95,2,16,3,false,false,false,false
